{
  "id": "rule_r12_rollback_plan_required_high_risk",
  "type": "rule",
  "version": "0.9.0",
  "status": "draft",
  "metadata": {
    "created_at": "2026-01-25T08:29:46.676280+00:00",
    "checksum": "52364caa3cfccf80216aa3602a1bbee6646b1321b7e6b3d686ae988385c38dc1",
    "is_root": true,
    "tags": [
      "rollback",
      "risk-management",
      "safety"
    ]
  },
  "spec": {
    "id": "rule_r12_rollback_plan_required_high_risk",
    "type": "rule",
    "title": "High risk operations must have rollback plan",
    "description": "Commands and workflows with risk_level=high must include a rollback_plan specifying how to undo changes if they fail.",
    "version": "0.9.0",
    "status": "active",
    "lineage": {
      "introduced_in": "v0.9",
      "derived_from": null,
      "supersedes": []
    },
    "constraints": {
      "execution": "forbidden"
    },
    "rule": {
      "severity": "error",
      "scope": {
        "applies_to_types": [
          "workflow",
          "command"
        ],
        "applies_to_risk": [
          "high",
          "critical"
        ],
        "applies_to_phases": [
          "design",
          "implementation",
          "validation",
          "review"
        ]
      },
      "when": {
        "all_of": [
          {
            "risk_level_high_or_critical": true
          },
          {
            "rollback_plan_missing": true
          }
        ]
      },
      "then": {
        "decision": "deny",
        "reason": "High risk operations require documented rollback strategy",
        "required_changes": [
          "Add rollback_plan field with undo steps",
          "Specify rollback triggers (failure conditions)",
          "Test rollback procedure before approval"
        ]
      },
      "evidence_required": [
        "risk_assessment",
        "rollback_plan",
        "rollback_test_result"
      ]
    },
    "metadata": {
      "tags": [
        "rollback",
        "risk-management",
        "safety"
      ],
      "author": "AgentOS Team"
    }
  }
}